Item Name,Listings,Price,Currency,Timestamp
Sealed Graffiti | Recoil PP-Bizon (Monster Purple),7,5.88,CDN,2023-08-30 12:35:44.357484
Sealed Graffiti | Recoil M4A4 (Dust Brown),14,1.56,CDN,2023-08-30 12:35:44.357484
Sealed Graffiti | Recoil UMP-45 (War Pig Pink),11,55.77,CDN,2023-08-30 12:35:44.357484
Sealed Graffiti | Recoil CZ-75 (Princess Pink),10,2.41,CDN,2023-08-30 12:35:44.357484
Sealed Graffiti | Recoil P90 (Tiger Orange),20,1.99,CDN,2023-08-30 12:35:44.357484
Sealed Graffiti | Recoil MP7 (War Pig Pink),18,4.64,CDN,2023-08-30 12:35:44.357484
Sealed Graffiti | Recoil AUG (Bazooka Pink),8,2.04,CDN,2023-08-30 12:35:44.357484
Sealed Graffiti | Recoil UMP-45 (Brick Red),4,15.56,CDN,2023-08-30 12:35:44.357484
Sealed Graffiti | Recoil M4A4 (Battle Green),16,1.4,CDN,2023-08-30 12:35:44.357484
Sealed Graffiti | Recoil M4A1-S (Bazooka Pink),14,2.81,CDN,2023-08-30 12:35:44.357484
Sealed Graffiti | Recoil MP7 (SWAT Blue),17,1.08,CDN,2023-08-30 12:35:46.020889
Sealed Graffiti | Recoil XM1014 (Shark White),16,1.11,CDN,2023-08-30 12:35:46.020889
Sealed Graffiti | Recoil MP7 (Wire Blue),12,1.16,CDN,2023-08-30 12:35:46.020889
Sealed Graffiti | Recoil MP7 (Dust Brown),20,1.19,CDN,2023-08-30 12:35:46.020889
Sealed Graffiti | Recoil MP7 (Monarch Blue),14,1.21,CDN,2023-08-30 12:35:46.020889
Sealed Graffiti | Recoil MAC-10 (Brick Red),25,1.21,CDN,2023-08-30 12:35:46.020889
Sealed Graffiti | Recoil MAC-10 (Dust Brown),18,1.22,CDN,2023-08-30 12:35:46.020889
Sealed Graffiti | Recoil MAC-10 (Battle Green),17,1.24,CDN,2023-08-30 12:35:46.020889
Sealed Graffiti | Recoil CZ-75 (Violent Violet),28,1.24,CDN,2023-08-30 12:35:46.020889
Sealed Graffiti | Recoil P90 (Jungle Green),18,1.27,CDN,2023-08-30 12:35:46.020889
Sealed Graffiti | Recoil P90 (Shark White),13,1.27,CDN,2023-08-30 12:36:00.113635
Sealed Graffiti | Recoil MP7 (Violent Violet),15,1.27,CDN,2023-08-30 12:36:00.113635
Sealed Graffiti | Recoil XM1014 (Monarch Blue),23,1.28,CDN,2023-08-30 12:36:00.113635
Sealed Graffiti | Recoil SG 553 (Brick Red),28,1.28,CDN,2023-08-30 12:36:00.113635
Sealed Graffiti | Recoil MP7 (Cash Green),25,1.28,CDN,2023-08-30 12:36:00.113635
Sealed Graffiti | Recoil AUG (Cash Green),15,1.26,CDN,2023-08-30 12:36:00.113635
Sealed Graffiti | Recoil Galil AR (Violent Violet),21,1.3,CDN,2023-08-30 12:36:00.113635
Sealed Graffiti | Recoil P90 (Monster Purple),14,1.31,CDN,2023-08-30 12:36:00.113635
Sealed Graffiti | Recoil MAC-10 (SWAT Blue),17,1.31,CDN,2023-08-30 12:36:00.113635
Sealed Graffiti | Recoil P90 (Desert Amber),23,1.31,CDN,2023-08-30 12:36:00.113635
Sealed Graffiti | Recoil MP9 (Desert Amber),23,1.31,CDN,2023-08-30 12:36:01.217061
Sealed Graffiti | Recoil Galil AR (Princess Pink),24,1.33,CDN,2023-08-30 12:36:01.217061
Sealed Graffiti | Recoil MP9 (Brick Red),32,1.33,CDN,2023-08-30 12:36:01.217061
Sealed Graffiti | Recoil MAC-10 (Tiger Orange),16,1.33,CDN,2023-08-30 12:36:01.217061
Sealed Graffiti | Recoil XM1014 (Blood Red),20,1.33,CDN,2023-08-30 12:36:01.217061
Sealed Graffiti | Recoil PP-Bizon (Dust Brown),20,1.33,CDN,2023-08-30 12:36:01.217061
Sealed Graffiti | Recoil XM1014 (Desert Amber),10,1.34,CDN,2023-08-30 12:36:01.217061
Sealed Graffiti | Recoil FAMAS (Battle Green),16,1.34,CDN,2023-08-30 12:36:01.217061
Sealed Graffiti | Recoil MP9 (Tiger Orange),12,1.35,CDN,2023-08-30 12:36:01.217061
Sealed Graffiti | Recoil P90 (Frog Green),15,1.38,CDN,2023-08-30 12:36:01.217061
Sealed Graffiti | Recoil SG 553 (Monster Purple),15,1.39,CDN,2023-08-30 12:36:02.321145
Sealed Graffiti | Recoil XM1014 (Princess Pink),16,1.39,CDN,2023-08-30 12:36:02.321145
Sealed Graffiti | Recoil SG 553 (Princess Pink),17,1.41,CDN,2023-08-30 12:36:02.321145
Sealed Graffiti | Recoil XM1014 (Tracer Yellow),16,1.41,CDN,2023-08-30 12:36:02.321145
Sealed Graffiti | Recoil MP7 (Monster Purple),31,1.41,CDN,2023-08-30 12:36:02.321145
Sealed Graffiti | Recoil CZ-75 (Desert Amber),21,1.41,CDN,2023-08-30 12:36:02.321145
Sealed Graffiti | Recoil XM1014 (Frog Green),10,1.41,CDN,2023-08-30 12:36:02.321145
Sealed Graffiti | Recoil M4A4 (Battle Green),16,1.4,CDN,2023-08-30 12:36:02.321145
Sealed Graffiti | Recoil FAMAS (SWAT Blue),15,1.42,CDN,2023-08-30 12:36:02.321145
Sealed Graffiti | Recoil XM1014 (Dust Brown),21,1.42,CDN,2023-08-30 12:36:02.321145
Sealed Graffiti | Recoil Galil AR (Monarch Blue),16,1.43,CDN,2023-08-30 12:36:03.441939
Sealed Graffiti | Recoil SG 553 (Bazooka Pink),14,1.44,CDN,2023-08-30 12:36:03.441939
Sealed Graffiti | Recoil PP-Bizon (Brick Red),17,1.44,CDN,2023-08-30 12:36:03.441939
Sealed Graffiti | Recoil Galil AR (Bazooka Pink),14,1.44,CDN,2023-08-30 12:36:03.441939
Sealed Graffiti | Recoil MAC-10 (Wire Blue),13,1.45,CDN,2023-08-30 12:36:03.441939
Sealed Graffiti | Recoil SG 553 (Blood Red),20,1.47,CDN,2023-08-30 12:36:03.441939
Sealed Graffiti | Recoil MAC-10 (Shark White),18,1.47,CDN,2023-08-30 12:36:03.441939
Sealed Graffiti | Recoil AUG (Desert Amber),14,1.47,CDN,2023-08-30 12:36:03.441939
Sealed Graffiti | Recoil MP7 (Blood Red),13,1.47,CDN,2023-08-30 12:36:03.441939
Sealed Graffiti | Recoil MAC-10 (Cash Green),14,1.47,CDN,2023-08-30 12:36:03.441939
Sealed Graffiti | Recoil MP7 (Blood Red),13,1.47,CDN,2023-08-30 12:36:05.565770
Sealed Graffiti | Recoil AUG (Frog Green),16,1.45,CDN,2023-08-30 12:36:05.565770
Sealed Graffiti | Recoil CZ-75 (Frog Green),18,1.47,CDN,2023-08-30 12:36:05.565770
Sealed Graffiti | Recoil SG 553 (Violent Violet),18,1.49,CDN,2023-08-30 12:36:05.565770
Sealed Graffiti | Recoil CZ-75 (Tracer Yellow),22,1.49,CDN,2023-08-30 12:36:05.565770
Sealed Graffiti | Recoil PP-Bizon (Tracer Yellow),18,1.49,CDN,2023-08-30 12:36:05.565770
Sealed Graffiti | Recoil AUG (Shark White),16,1.49,CDN,2023-08-30 12:36:05.565770
Sealed Graffiti | Recoil PP-Bizon (Bazooka Pink),15,1.49,CDN,2023-08-30 12:36:05.565770
Sealed Graffiti | Recoil CZ-75 (SWAT Blue),16,1.49,CDN,2023-08-30 12:36:05.565770
Sealed Graffiti | Recoil MP9 (Dust Brown),13,1.49,CDN,2023-08-30 12:36:05.565770
Sealed Graffiti | Recoil AUG (Monster Purple),13,1.49,CDN,2023-08-30 12:36:07.168770
Sealed Graffiti | Recoil CZ-75 (Tiger Orange),24,1.49,CDN,2023-08-30 12:36:07.168770
Sealed Graffiti | Recoil AUG (Tiger Orange),22,1.5,CDN,2023-08-30 12:36:07.168770
Sealed Graffiti | Recoil FAMAS (Dust Brown),14,1.5,CDN,2023-08-30 12:36:07.168770
Sealed Graffiti | Recoil Galil AR (SWAT Blue),15,1.5,CDN,2023-08-30 12:36:07.168770
Sealed Graffiti | Recoil M4A4 (Desert Amber),21,1.5,CDN,2023-08-30 12:36:07.168770
Sealed Graffiti | Recoil Galil AR (Jungle Green),20,1.52,CDN,2023-08-30 12:36:07.168770
Sealed Graffiti | Recoil MP9 (Tracer Yellow),14,1.52,CDN,2023-08-30 12:36:07.168770
Sealed Graffiti | Recoil AUG (Princess Pink),15,1.52,CDN,2023-08-30 12:36:07.168770
Sealed Graffiti | Recoil P90 (Bazooka Pink),17,1.52,CDN,2023-08-30 12:36:07.168770
Sealed Graffiti | Recoil SG 553 (Cash Green),13,1.53,CDN,2023-08-30 12:36:08.264662
Sealed Graffiti | Recoil AUG (War Pig Pink),19,1.53,CDN,2023-08-30 12:36:08.264662
Sealed Graffiti | Recoil P90 (Tracer Yellow),11,1.53,CDN,2023-08-30 12:36:08.264662
Sealed Graffiti | Recoil PP-Bizon (Shark White),12,1.54,CDN,2023-08-30 12:36:08.264662
Sealed Graffiti | Recoil MAC-10 (Violent Violet),11,1.55,CDN,2023-08-30 12:36:08.264662
Sealed Graffiti | Recoil FAMAS (Princess Pink),18,1.55,CDN,2023-08-30 12:36:08.264662
Sealed Graffiti | Recoil PP-Bizon (Tiger Orange),15,1.55,CDN,2023-08-30 12:36:08.264662
Sealed Graffiti | Recoil M4A4 (Dust Brown),14,1.56,CDN,2023-08-30 12:36:08.264662
Sealed Graffiti | Recoil XM1014 (Bazooka Pink),15,1.57,CDN,2023-08-30 12:36:08.264662
Sealed Graffiti | Recoil SG 553 (Frog Green),12,1.61,CDN,2023-08-30 12:36:08.264662
Sealed Graffiti | Recoil CZ-75 (Monarch Blue),14,1.61,CDN,2023-08-30 12:36:10.395613
Sealed Graffiti | Recoil M4A4 (Frog Green),17,1.61,CDN,2023-08-30 12:36:10.395613
Sealed Graffiti | Recoil CZ-75 (Wire Blue),16,1.61,CDN,2023-08-30 12:36:10.395613
Sealed Graffiti | Recoil M4A4 (Violent Violet),28,1.61,CDN,2023-08-30 12:36:10.395613
Sealed Graffiti | Recoil M4A4 (Shark White),23,1.62,CDN,2023-08-30 12:36:10.395613
Sealed Graffiti | Recoil MAC-10 (War Pig Pink),11,1.62,CDN,2023-08-30 12:36:10.395613
Sealed Graffiti | Recoil PP-Bizon (Blood Red),14,1.63,CDN,2023-08-30 12:36:10.395613
Sealed Graffiti | Recoil M4A4 (Princess Pink),23,1.63,CDN,2023-08-30 12:36:10.395613
Sealed Graffiti | Recoil M4A4 (Monster Purple),14,1.64,CDN,2023-08-30 12:36:10.395613
Sealed Graffiti | Recoil MP7 (Brick Red),11,1.61,CDN,2023-08-30 12:36:10.395613
Sealed Graffiti | Recoil P90 (SWAT Blue),12,1.64,CDN,2023-08-30 12:36:11.503478
Sealed Graffiti | Recoil CZ-75 (Bazooka Pink),12,1.64,CDN,2023-08-30 12:36:11.503478
Sealed Graffiti | Recoil P90 (Violent Violet),13,1.64,CDN,2023-08-30 12:36:11.503478
Sealed Graffiti | Recoil Galil AR (War Pig Pink),16,1.65,CDN,2023-08-30 12:36:11.503478
Sealed Graffiti | Recoil AUG (Violent Violet),10,1.65,CDN,2023-08-30 12:36:11.503478
Sealed Graffiti | Recoil SG 553 (Battle Green),13,1.65,CDN,2023-08-30 12:36:11.503478
Sealed Graffiti | Recoil Galil AR (Tiger Orange),14,1.65,CDN,2023-08-30 12:36:11.503478
Sealed Graffiti | Recoil PP-Bizon (Jungle Green),16,1.66,CDN,2023-08-30 12:36:11.503478
Sealed Graffiti | Recoil AUG (SWAT Blue),11,1.66,CDN,2023-08-30 12:36:11.503478
Sealed Graffiti | Recoil FAMAS (Wire Blue),15,1.67,CDN,2023-08-30 12:36:11.503478
Sealed Graffiti | Recoil SG 553 (Dust Brown),14,1.68,CDN,2023-08-30 12:36:13.153544
Sealed Graffiti | Recoil P90 (Dust Brown),11,1.68,CDN,2023-08-30 12:36:13.153544
Sealed Graffiti | Recoil Galil AR (Frog Green),13,1.69,CDN,2023-08-30 12:36:13.153544
Sealed Graffiti | Recoil CZ-75 (Shark White),17,1.69,CDN,2023-08-30 12:36:13.153544
Sealed Graffiti | Recoil M4A4 (Tiger Orange),16,1.69,CDN,2023-08-30 12:36:13.153544
Sealed Graffiti | Recoil M4A1-S (Dust Brown),21,1.7,CDN,2023-08-30 12:36:13.153544
Sealed Graffiti | Recoil CZ-75 (War Pig Pink),19,1.72,CDN,2023-08-30 12:36:13.153544
Sealed Graffiti | Recoil CZ-75 (Brick Red),13,1.72,CDN,2023-08-30 12:36:13.153544
Sealed Graffiti | Recoil CZ-75 (Battle Green),19,1.73,CDN,2023-08-30 12:36:13.153544
Sealed Graffiti | Recoil PP-Bizon (Frog Green),11,1.76,CDN,2023-08-30 12:36:13.153544
Sealed Graffiti | Recoil XM1014 (Tiger Orange),16,1.74,CDN,2023-08-30 12:36:15.848457
Sealed Graffiti | Recoil MP9 (Wire Blue),16,1.76,CDN,2023-08-30 12:36:15.848457
Sealed Graffiti | Recoil AUG (Monarch Blue),16,1.76,CDN,2023-08-30 12:36:15.848457
Sealed Graffiti | Recoil XM1014 (Jungle Green),17,1.76,CDN,2023-08-30 12:36:15.848457
Sealed Graffiti | Recoil PP-Bizon (Princess Pink),10,1.76,CDN,2023-08-30 12:36:15.848457
Sealed Graffiti | Recoil Galil AR (Tracer Yellow),14,1.77,CDN,2023-08-30 12:36:15.848457
Sealed Graffiti | Recoil PP-Bizon (Desert Amber),19,1.78,CDN,2023-08-30 12:36:15.848457
Sealed Graffiti | Recoil MP9 (Battle Green),12,1.78,CDN,2023-08-30 12:36:15.848457
Sealed Graffiti | Recoil FAMAS (Monster Purple),21,1.79,CDN,2023-08-30 12:36:15.848457
Sealed Graffiti | Recoil M4A1-S (Battle Green),19,1.81,CDN,2023-08-30 12:36:15.848457
Sealed Graffiti | Recoil M4A4 (SWAT Blue),20,1.84,CDN,2023-08-30 12:36:17.461545
Sealed Graffiti | Recoil Galil AR (Dust Brown),12,1.85,CDN,2023-08-30 12:36:17.461545
Sealed Graffiti | Recoil SG 553 (War Pig Pink),13,1.86,CDN,2023-08-30 12:36:17.461545
Sealed Graffiti | Recoil AUG (Jungle Green),16,1.86,CDN,2023-08-30 12:36:17.461545
Sealed Graffiti | Recoil CZ-75 (Monster Purple),10,1.87,CDN,2023-08-30 12:36:17.461545
Sealed Graffiti | Recoil P90 (Brick Red),22,1.87,CDN,2023-08-30 12:36:17.461545
Sealed Graffiti | Recoil FAMAS (Cash Green),16,1.89,CDN,2023-08-30 12:36:17.461545
Sealed Graffiti | Recoil FAMAS (Bazooka Pink),15,1.89,CDN,2023-08-30 12:36:17.461545
Sealed Graffiti | Recoil PP-Bizon (SWAT Blue),16,1.91,CDN,2023-08-30 12:36:17.461545
Sealed Graffiti | Recoil P90 (Blood Red),11,1.91,CDN,2023-08-30 12:36:17.461545
Sealed Graffiti | Recoil MAC-10 (Princess Pink),14,1.92,CDN,2023-08-30 12:36:20.659518
Sealed Graffiti | Recoil Galil AR (Wire Blue),11,1.92,CDN,2023-08-30 12:36:20.659518
Sealed Graffiti | Recoil Galil AR (Brick Red),23,1.95,CDN,2023-08-30 12:36:20.659518
Sealed Graffiti | Recoil CZ-75 (Cash Green),11,1.91,CDN,2023-08-30 12:36:20.659518
Sealed Graffiti | Recoil MP9 (Jungle Green),14,1.96,CDN,2023-08-30 12:36:20.659518
Sealed Graffiti | Recoil M4A4 (Tracer Yellow),35,1.99,CDN,2023-08-30 12:36:20.659518
Sealed Graffiti | Recoil MP9 (Bazooka Pink),11,1.99,CDN,2023-08-30 12:36:20.659518
Sealed Graffiti | Recoil MAC-10 (Frog Green),18,2.0,CDN,2023-08-30 12:36:20.659518
Sealed Graffiti | Recoil P90 (Tiger Orange),20,1.99,CDN,2023-08-30 12:36:20.659518
Sealed Graffiti | Recoil MP9 (Blood Red),14,2.01,CDN,2023-08-30 12:36:20.659518
Sealed Graffiti | Recoil FAMAS (Monarch Blue),12,2.04,CDN,2023-08-30 12:36:22.824417
Sealed Graffiti | Recoil MP9 (Monarch Blue),17,2.03,CDN,2023-08-30 12:36:22.824417
Sealed Graffiti | Recoil Galil AR (Cash Green),13,2.04,CDN,2023-08-30 12:36:22.824417
Sealed Graffiti | Recoil M4A4 (Blood Red),29,2.04,CDN,2023-08-30 12:36:22.824417
Sealed Graffiti | Recoil FAMAS (Brick Red),12,2.04,CDN,2023-08-30 12:36:22.824417
Sealed Graffiti | Recoil AUG (Bazooka Pink),8,2.04,CDN,2023-08-30 12:36:22.824417
Sealed Graffiti | Recoil MP9 (SWAT Blue),23,2.07,CDN,2023-08-30 12:36:22.824417
Sealed Graffiti | Recoil AUG (Tracer Yellow),21,2.04,CDN,2023-08-30 12:36:22.824417
Sealed Graffiti | Recoil PP-Bizon (War Pig Pink),14,2.09,CDN,2023-08-30 12:36:22.824417
Sealed Graffiti | Recoil PP-Bizon (Violent Violet),14,2.12,CDN,2023-08-30 12:36:22.824417
Sealed Graffiti | Recoil MP7 (Bazooka Pink),15,2.14,CDN,2023-08-30 12:36:40.128480
Sealed Graffiti | Recoil P90 (Princess Pink),13,2.18,CDN,2023-08-30 12:36:40.128480
Sealed Graffiti | Recoil AUG (Battle Green),13,2.19,CDN,2023-08-30 12:36:40.128480
Sealed Graffiti | Recoil M4A1-S (Princess Pink),13,2.19,CDN,2023-08-30 12:36:40.128480
Sealed Graffiti | Recoil AUG (Blood Red),18,2.21,CDN,2023-08-30 12:36:40.128480
Sealed Graffiti | Recoil M4A1-S (Jungle Green),22,2.22,CDN,2023-08-30 12:36:40.128480
Sealed Graffiti | Recoil M4A4 (Jungle Green),19,2.23,CDN,2023-08-30 12:36:40.128480
Sealed Graffiti | Recoil SG 553 (Jungle Green),15,2.23,CDN,2023-08-30 12:36:40.128480
Sealed Graffiti | Recoil FAMAS (Tiger Orange),12,2.24,CDN,2023-08-30 12:36:40.128480
Sealed Graffiti | Recoil M4A4 (War Pig Pink),12,2.3,CDN,2023-08-30 12:36:40.128480
Sealed Graffiti | Recoil SG 553 (Wire Blue),16,2.31,CDN,2023-08-30 12:36:41.807360
Sealed Graffiti | Recoil MAC-10 (Monster Purple),8,2.31,CDN,2023-08-30 12:36:41.807360
Sealed Graffiti | Recoil MAC-10 (Monarch Blue),15,2.32,CDN,2023-08-30 12:36:41.807360
Sealed Graffiti | Recoil MAC-10 (Blood Red),18,2.32,CDN,2023-08-30 12:36:41.807360
Sealed Graffiti | Recoil M4A1-S (Frog Green),11,2.34,CDN,2023-08-30 12:36:41.807360
Sealed Graffiti | Recoil MP9 (Shark White),16,2.35,CDN,2023-08-30 12:36:41.807360
Sealed Graffiti | Recoil Galil AR (Monster Purple),13,2.36,CDN,2023-08-30 12:36:41.807360
Sealed Graffiti | Recoil M4A1-S (Tracer Yellow),23,2.39,CDN,2023-08-30 12:36:41.807360
Sealed Graffiti | Recoil MP9 (Cash Green),15,2.39,CDN,2023-08-30 12:36:41.807360
Sealed Graffiti | Recoil CZ-75 (Princess Pink),10,2.41,CDN,2023-08-30 12:36:41.807360
Sealed Graffiti | Recoil MP7 (Tiger Orange),14,2.45,CDN,2023-08-30 12:36:56.305302
Sealed Graffiti | Recoil FAMAS (Frog Green),14,2.45,CDN,2023-08-30 12:36:56.305302
Sealed Graffiti | Recoil P90 (Monarch Blue),13,2.48,CDN,2023-08-30 12:36:56.305302
Sealed Graffiti | Recoil M4A1-S (Cash Green),17,2.46,CDN,2023-08-30 12:36:56.305302
Sealed Graffiti | Recoil M4A1-S (Desert Amber),16,2.5,CDN,2023-08-30 12:36:56.305302
Sealed Graffiti | Recoil XM1014 (Monster Purple),9,2.58,CDN,2023-08-30 12:36:56.305302
Sealed Graffiti | Recoil M4A1-S (Monster Purple),19,2.59,CDN,2023-08-30 12:36:56.305302
Sealed Graffiti | Recoil MP7 (Shark White),12,2.61,CDN,2023-08-30 12:36:56.305302
Sealed Graffiti | Recoil M4A1-S (SWAT Blue),12,2.61,CDN,2023-08-30 12:36:56.305302
Sealed Graffiti | Recoil XM1014 (Cash Green),24,2.62,CDN,2023-08-30 12:36:56.305302
Sealed Graffiti | Recoil MP9 (War Pig Pink),16,2.62,CDN,2023-08-30 12:36:58.945537
Sealed Graffiti | Recoil MAC-10 (Desert Amber),10,2.64,CDN,2023-08-30 12:36:58.945537
Sealed Graffiti | Recoil FAMAS (Violent Violet),9,2.64,CDN,2023-08-30 12:36:58.945537
Sealed Graffiti | Recoil MP9 (Princess Pink),9,2.65,CDN,2023-08-30 12:36:58.945537
Sealed Graffiti | Recoil XM1014 (SWAT Blue),33,2.65,CDN,2023-08-30 12:36:58.945537
Sealed Graffiti | Recoil CZ-75 (Blood Red),15,2.65,CDN,2023-08-30 12:36:58.945537
Sealed Graffiti | Recoil M4A1-S (Blood Red),22,2.7,CDN,2023-08-30 12:36:58.945537
Sealed Graffiti | Recoil XM1014 (Brick Red),23,2.7,CDN,2023-08-30 12:36:58.945537
Sealed Graffiti | Recoil M4A1-S (Brick Red),16,2.7,CDN,2023-08-30 12:36:58.945537
Sealed Graffiti | Recoil FAMAS (War Pig Pink),10,2.7,CDN,2023-08-30 12:36:58.945537
Sealed Graffiti | Recoil M4A1-S (Tiger Orange),10,2.72,CDN,2023-08-30 12:37:01.580961
Sealed Graffiti | Recoil MP9 (Frog Green),15,2.78,CDN,2023-08-30 12:37:01.580961
Sealed Graffiti | Recoil FAMAS (Jungle Green),9,2.77,CDN,2023-08-30 12:37:01.580961
Sealed Graffiti | Recoil M4A1-S (Bazooka Pink),14,2.81,CDN,2023-08-30 12:37:01.580961
Sealed Graffiti | Recoil SG 553 (Monarch Blue),14,2.81,CDN,2023-08-30 12:37:01.580961
Sealed Graffiti | Recoil PP-Bizon (Battle Green),9,2.82,CDN,2023-08-30 12:37:01.580961
Sealed Graffiti | Recoil MAC-10 (Tracer Yellow),17,2.82,CDN,2023-08-30 12:37:01.580961
Sealed Graffiti | Recoil P90 (Cash Green),7,2.82,CDN,2023-08-30 12:37:01.580961
Sealed Graffiti | Recoil M4A4 (Monarch Blue),12,2.83,CDN,2023-08-30 12:37:01.580961
Sealed Graffiti | Recoil SG 553 (SWAT Blue),17,2.92,CDN,2023-08-30 12:37:01.580961
Sealed Graffiti | Recoil M4A4 (Cash Green),17,2.94,CDN,2023-08-30 12:37:04.387109
Sealed Graffiti | Recoil P90 (Wire Blue),7,2.95,CDN,2023-08-30 12:37:04.387109
Sealed Graffiti | Recoil CZ-75 (Jungle Green),9,3.03,CDN,2023-08-30 12:37:04.387109
Sealed Graffiti | Recoil MP9 (Monster Purple),13,3.03,CDN,2023-08-30 12:37:04.387109
Sealed Graffiti | Recoil XM1014 (Battle Green),21,3.19,CDN,2023-08-30 12:37:04.387109
Sealed Graffiti | Recoil M4A1-S (Wire Blue),14,3.27,CDN,2023-08-30 12:37:04.387109
Sealed Graffiti | Recoil XM1014 (Wire Blue),6,3.29,CDN,2023-08-30 12:37:04.387109
Sealed Graffiti | Recoil MAC-10 (Bazooka Pink),11,3.35,CDN,2023-08-30 12:37:04.387109
Sealed Graffiti | Recoil FAMAS (Tracer Yellow),14,3.36,CDN,2023-08-30 12:37:04.387109
Sealed Graffiti | Recoil M4A1-S (Shark White),10,3.42,CDN,2023-08-30 12:37:04.387109
Sealed Graffiti | Recoil UMP-45 (Dust Brown),8,3.41,CDN,2023-08-30 12:37:06.164021
Sealed Graffiti | Recoil M4A1-S (War Pig Pink),15,3.45,CDN,2023-08-30 12:37:06.164021
Sealed Graffiti | Recoil Galil AR (Blood Red),9,3.26,CDN,2023-08-30 12:37:06.164021
Sealed Graffiti | Recoil SG 553 (Shark White),15,3.5,CDN,2023-08-30 12:37:06.164021
Sealed Graffiti | Recoil M4A4 (Brick Red),16,3.5,CDN,2023-08-30 12:37:06.164021
Sealed Graffiti | Recoil AK-47 (Monster Purple),20,3.58,CDN,2023-08-30 12:37:06.164021
Sealed Graffiti | Recoil M4A1-S (Monarch Blue),25,3.61,CDN,2023-08-30 12:37:06.164021
Sealed Graffiti | Recoil AUG (Brick Red),15,3.69,CDN,2023-08-30 12:37:06.164021
Sealed Graffiti | Recoil XM1014 (War Pig Pink),17,3.74,CDN,2023-08-30 12:37:06.164021
Sealed Graffiti | Recoil M4A4 (Bazooka Pink),12,3.86,CDN,2023-08-30 12:37:06.164021
Sealed Graffiti | Recoil CZ-75 (Dust Brown),7,3.86,CDN,2023-08-30 12:37:07.781674
Sealed Graffiti | Recoil M4A1-S (Violent Violet),17,3.92,CDN,2023-08-30 12:37:07.781674
Sealed Graffiti | Recoil AK-47 (SWAT Blue),21,3.92,CDN,2023-08-30 12:37:07.781674
Sealed Graffiti | Recoil AWP (Tiger Orange),16,3.94,CDN,2023-08-30 12:37:07.781674
Sealed Graffiti | Recoil AK-47 (Jungle Green),11,3.95,CDN,2023-08-30 12:37:07.781674
Sealed Graffiti | Recoil P90 (Battle Green),17,4.0,CDN,2023-08-30 12:37:07.781674
Sealed Graffiti | Recoil AK-47 (Tiger Orange),27,4.04,CDN,2023-08-30 12:37:07.781674
Sealed Graffiti | Recoil FAMAS (Shark White),8,4.06,CDN,2023-08-30 12:37:07.781674
Sealed Graffiti | Recoil AK-47 (Brick Red),9,4.04,CDN,2023-08-30 12:37:07.781674
Sealed Graffiti | Recoil FAMAS (Blood Red),17,4.1,CDN,2023-08-30 12:37:07.781674
Sealed Graffiti | Recoil PP-Bizon (Wire Blue),6,4.08,CDN,2023-08-30 12:37:09.390273
Sealed Graffiti | Recoil Galil AR (Shark White),7,4.16,CDN,2023-08-30 12:37:09.390273
Sealed Graffiti | Recoil AWP (Shark White),12,4.22,CDN,2023-08-30 12:37:09.390273
Sealed Graffiti | Recoil MP7 (Princess Pink),8,4.26,CDN,2023-08-30 12:37:09.390273
Sealed Graffiti | Recoil AK-47 (Monarch Blue),12,4.3,CDN,2023-08-30 12:37:09.390273
Sealed Graffiti | Recoil UMP-45 (Jungle Green),8,4.38,CDN,2023-08-30 12:37:09.390273
Sealed Graffiti | Recoil AK-47 (War Pig Pink),17,4.42,CDN,2023-08-30 12:37:09.390273
Sealed Graffiti | Recoil AK-47 (Violent Violet),23,4.43,CDN,2023-08-30 12:37:09.390273
Sealed Graffiti | Recoil AWP (Princess Pink),14,4.46,CDN,2023-08-30 12:37:09.390273
Sealed Graffiti | Recoil P90 (War Pig Pink),10,4.51,CDN,2023-08-30 12:37:09.390273
Sealed Graffiti | Recoil UMP-45 (Bazooka Pink),11,4.5,CDN,2023-08-30 12:37:10.519160
Sealed Graffiti | Recoil UMP-45 (Battle Green),9,4.53,CDN,2023-08-30 12:37:10.519160
Sealed Graffiti | Recoil AK-47 (Wire Blue),14,4.6,CDN,2023-08-30 12:37:10.519160
Sealed Graffiti | Recoil PP-Bizon (Cash Green),4,4.64,CDN,2023-08-30 12:37:10.519160
Sealed Graffiti | Recoil MP7 (War Pig Pink),18,4.64,CDN,2023-08-30 12:37:10.519160
Sealed Graffiti | Recoil UMP-45 (Tracer Yellow),8,4.77,CDN,2023-08-30 12:37:10.519160
Sealed Graffiti | Recoil PP-Bizon (Monarch Blue),7,4.78,CDN,2023-08-30 12:37:10.519160
Sealed Graffiti | Recoil AK-47 (Bazooka Pink),10,4.78,CDN,2023-08-30 12:37:10.519160
Sealed Graffiti | Recoil M4A4 (Wire Blue),20,4.84,CDN,2023-08-30 12:37:10.519160
Sealed Graffiti | Recoil MP7 (Desert Amber),9,4.92,CDN,2023-08-30 12:37:10.519160
Sealed Graffiti | Recoil AWP (Monarch Blue),24,4.94,CDN,2023-08-30 12:37:12.141701
Sealed Graffiti | Recoil AK-47 (Desert Amber),11,5.03,CDN,2023-08-30 12:37:12.141701
Sealed Graffiti | Recoil MP7 (Frog Green),12,5.06,CDN,2023-08-30 12:37:12.141701
Sealed Graffiti | Recoil AUG (Dust Brown),9,5.06,CDN,2023-08-30 12:37:12.141701
Sealed Graffiti | Recoil AK-47 (Battle Green),11,5.07,CDN,2023-08-30 12:37:12.141701
Sealed Graffiti | Recoil MP7 (Jungle Green),17,5.1,CDN,2023-08-30 12:37:12.141701
Sealed Graffiti | Recoil SG 553 (Tracer Yellow),14,5.22,CDN,2023-08-30 12:37:12.141701
Sealed Graffiti | Recoil AWP (Dust Brown),27,5.26,CDN,2023-08-30 12:37:12.141701
Sealed Graffiti | Recoil UMP-45 (Blood Red),8,5.25,CDN,2023-08-30 12:37:12.141701
Sealed Graffiti | Recoil MP9 (Violent Violet),9,5.29,CDN,2023-08-30 12:37:12.141701
Sealed Graffiti | Recoil AWP (Cash Green),17,5.33,CDN,2023-08-30 12:37:14.794989
Sealed Graffiti | Recoil UMP-45 (Cash Green),5,5.34,CDN,2023-08-30 12:37:14.794989
Sealed Graffiti | Recoil AWP (SWAT Blue),10,5.34,CDN,2023-08-30 12:37:14.794989
Sealed Graffiti | Recoil AWP (War Pig Pink),24,5.41,CDN,2023-08-30 12:37:14.794989
Sealed Graffiti | Recoil UMP-45 (Desert Amber),5,5.63,CDN,2023-08-30 12:37:14.794989
Sealed Graffiti | Recoil AWP (Wire Blue),11,5.65,CDN,2023-08-30 12:37:14.794989
Sealed Graffiti | Recoil UMP-45 (SWAT Blue),4,5.8,CDN,2023-08-30 12:37:14.794989
Sealed Graffiti | Recoil PP-Bizon (Monster Purple),7,5.88,CDN,2023-08-30 12:37:14.794989
Sealed Graffiti | Recoil AK-47 (Princess Pink),14,5.89,CDN,2023-08-30 12:37:14.794989
Sealed Graffiti | Recoil AWP (Jungle Green),24,5.9,CDN,2023-08-30 12:37:14.794989
Sealed Graffiti | Recoil AK-47 (Shark White),7,5.99,CDN,2023-08-30 12:37:16.996013
Sealed Graffiti | Recoil UMP-45 (Tiger Orange),4,6.0,CDN,2023-08-30 12:37:16.996013
Sealed Graffiti | Recoil UMP-45 (Frog Green),8,6.07,CDN,2023-08-30 12:37:16.996013
Sealed Graffiti | Recoil AWP (Battle Green),14,6.17,CDN,2023-08-30 12:37:16.996013
Sealed Graffiti | Recoil AWP (Violent Violet),17,6.37,CDN,2023-08-30 12:37:16.996013
Sealed Graffiti | Recoil AWP (Tracer Yellow),16,6.6,CDN,2023-08-30 12:37:16.996013
Sealed Graffiti | Recoil AK-47 (Cash Green),4,6.76,CDN,2023-08-30 12:37:16.996013
Sealed Graffiti | Recoil UMP-45 (Shark White),6,6.86,CDN,2023-08-30 12:37:16.996013
Sealed Graffiti | Recoil AK-47 (Blood Red),13,7.02,CDN,2023-08-30 12:37:16.996013
Sealed Graffiti | Recoil AK-47 (Frog Green),11,7.08,CDN,2023-08-30 12:37:16.996013
Sealed Graffiti | Recoil MP7 (Battle Green),12,7.13,CDN,2023-08-30 12:37:18.617359
Sealed Graffiti | Recoil AWP (Frog Green),13,7.26,CDN,2023-08-30 12:37:18.617359
Sealed Graffiti | Recoil MP7 (Tracer Yellow),11,7.89,CDN,2023-08-30 12:37:18.617359
Sealed Graffiti | Recoil UMP-45 (Wire Blue),9,8.1,CDN,2023-08-30 12:37:18.617359
Sealed Graffiti | Recoil UMP-45 (Monster Purple),8,8.17,CDN,2023-08-30 12:37:18.617359
Sealed Graffiti | Recoil UMP-45 (Monarch Blue),6,8.32,CDN,2023-08-30 12:37:18.617359
Sealed Graffiti | Recoil UMP-45 (Princess Pink),11,8.46,CDN,2023-08-30 12:37:18.617359
Sealed Graffiti | Recoil MAC-10 (Jungle Green),6,8.54,CDN,2023-08-30 12:37:18.617359
Sealed Graffiti | Recoil AK-47 (Tracer Yellow),5,8.64,CDN,2023-08-30 12:37:18.617359
Sealed Graffiti | Recoil Galil AR (Battle Green),14,9.56,CDN,2023-08-30 12:37:18.617359
Sealed Graffiti | Recoil AWP (Monster Purple),12,10.07,CDN,2023-08-30 12:37:19.767206
Sealed Graffiti | Recoil AWP (Desert Amber),10,10.27,CDN,2023-08-30 12:37:19.767206
Sealed Graffiti | Recoil AWP (Brick Red),9,10.52,CDN,2023-08-30 12:37:19.767206
Sealed Graffiti | Recoil XM1014 (Violent Violet),5,11.27,CDN,2023-08-30 12:37:19.767206
Sealed Graffiti | Recoil AUG (Wire Blue),7,11.7,CDN,2023-08-30 12:37:19.767206
